{
  "$schema": "https://json-schema.org/draft/2020-12/schema", "$id": "kilix.content.retention-counts/v1", "type": "object", "additionalProperties": false,
  "required": ["schema", "kind", "version", "release_id", "stable_slot_digest", "authority_digest", "output_digest", "counts"],
  "properties": {"schema": {"const": "kilix.content.retention/v1"}, "kind": {"const": "counts"}, "version": {"type": "integer", "const": 1}, "release_id": {"type": "string", "pattern": "^[a-z0-9][a-z0-9._-]{0,63}$"}, "stable_slot_digest": {"type": "string", "pattern": "^[0-9a-f]{64}$"}, "authority_digest": {"type": "string", "pattern": "^[0-9a-f]{64}$"}, "output_digest": {"type": "string", "pattern": "^[0-9a-f]{64}$"}, "counts": {"type": "object", "additionalProperties": false, "required": ["R_present", "R_pending", "R_counted", "O_materialized", "O_referenced", "O_counted", "retained_unique_objects", "retained_versions", "global_bytes", "global_files", "per_slot_bytes", "per_slot_files", "prospective_bytes", "prospective_files"], "properties": {"R_present": {"type": "array"}, "R_pending": {"type": "array"}, "R_counted": {"type": "array"}, "O_materialized": {"type": "array"}, "O_referenced": {"type": "array"}, "O_counted": {"type": "array"}, "retained_unique_objects": {"type": "integer", "minimum": 0}, "retained_versions": {"type": "object", "additionalProperties": {"type": "integer", "minimum": 0}}, "global_bytes": {"type": "integer", "minimum": 0}, "global_files": {"type": "integer", "minimum": 0}, "per_slot_bytes": {"type": "integer", "minimum": 0}, "per_slot_files": {"type": "integer", "minimum": 0}, "prospective_bytes": {"type": "integer", "minimum": 0}, "prospective_files": {"type": "integer", "minimum": 0}}}}
}
