{"authority_digest":"0000000000000000000000000000000000000000000000000000000000000010","counts":{"O_counted":["0000000000000000000000000000000000000000000000000000000000000017"],"O_materialized":["0000000000000000000000000000000000000000000000000000000000000017"],"O_referenced":[],"R_counted":["0000000000000000000000000000000000000000000000000000000000000027"],"R_pending":[],"R_present":["0000000000000000000000000000000000000000000000000000000000000027"],"global_bytes":512,"global_files":4,"per_slot_bytes":512,"per_slot_files":4,"prospective_bytes":768,"prospective_files":5,"retained_unique_objects":1,"retained_versions":{"demo-slot":1}},"kind":"counts","output_digest":"0000000000000000000000000000000000000000000000000000000000000017","release_id":"release-0.2.1","schema":"kilix.content.retention/v1","stable_slot_digest":"0000000000000000000000000000000000000000000000000000000000000033","version":1}
